{
  "machine_interface": 2,
  "host": "192.0.2.10",
  "app": "blog",
  "type": "ssh",
  "public_key": "ssh-ed25519 AAAAC3NzaC1lZDI1NTE5AAAAIPmM9PmN0c9Jl0uR0aX1w2y3z4a5b6c7d8e9f0g1h2 teploy-deploy-blog",
  "fingerprint": "256 SHA256:5kO5b5VqPm0s9R8tT1uV2wX3yZ4a5B6c7D8e9F0g1H2 teploy-deploy-blog (ED25519)",
  "created": true
}
